{
  "$schema": "https://json-schema.org/draft/2020-12/schema",
  "$id": "https://github.com/newcovid/nonebot-plugin-yijing/data/schemas/wenyan.schema.json",
  "title": "wenyan",
  "description": "Canonical Wenyan Zhuan records. The canonical layer is limited to Qian and Kun.",
  "type": "array",
  "items": {
    "type": "object",
    "additionalProperties": true,
    "required": [
      "hexagram_seq",
      "hexagram_name",
      "scope",
      "text",
      "source_id",
      "status"
    ],
    "properties": {
      "hexagram_seq": {
        "type": "integer",
        "enum": [
          1,
          2
        ]
      },
      "hexagram_name": {
        "type": "string",
        "enum": [
          "乾",
          "坤"
        ]
      },
      "scope": {
        "type": "string",
        "enum": [
          "canonical_wenyan"
        ]
      },
      "text": {
        "type": "string"
      },
      "sections": {
        "type": "array",
        "items": {
          "type": "object",
          "additionalProperties": true,
          "required": [
            "order",
            "text"
          ],
          "properties": {
            "order": {
              "type": "integer",
              "minimum": 1
            },
            "text": {
              "type": "string"
            }
          }
        }
      },
      "source_id": {
        "type": "string",
        "minLength": 1
      },
      "status": {
        "type": "string",
        "enum": [
          "placeholder",
          "draft",
          "seeded",
          "checked",
          "verified"
        ]
      },
      "notes": {
        "type": "string"
      },
      "edition": {
        "type": "string"
      },
      "source_locator": {
        "type": "string"
      },
      "collation_notes": {
        "type": "string"
      }
    }
  }
}
